{
  "project_id": "loop-engineering-framework",
  "loop_id": "phase-a-bootstrap",
  "current_state": "ACCEPTED",
  "allowed_next_states": ["DONE", "HUMAN_GATE"],
  "base_branch": "loop-engineering-phase-a3",
  "base_commit": "59a1a392de4c38a2266e555518cee4b147eda274",
  "work_branch": "loop-engineering-pilot-1-plan-v2",
  "worktree_path": "C:\\taiki\\hobbies\\stock-analyzer-loop-engineering-pilot-1-plan-v2",
  "current_task": "Create loop_control/PILOT_STATE_GLOSSARY.md containing concise definitions of the 12 loop states from LOOP_ENGINEERING_DESIGN.md; do not modify any other non-control file.",
  "task_hash": "3a954790c8458779cd1eb970c18d35cbff08b3a9769f55c482137e1cd14a1d87",
  "attempt": 1,
  "max_attempts": 2,
  "budget_remaining": {"max_agent_runs": 10, "max_retries": 1, "max_api_calls": 0, "max_download_bytes": 0, "max_changed_files": 4, "max_model_fits": 0, "max_evaluations": 1},
  "human_gate": {"required": false, "approval_id": null, "requested_action": null, "return_state": null},
  "last_verified_commit": "b8df3e9d90c36ba40d0d31c1ae9f96d23f7ebe98",
  "created_at": "2026-08-03T00:00:00Z",
  "updated_at": "2026-08-03T06:10:49Z"
}
